[
  {
    "operation_id": "discovery.retrieve",
    "owner": "CMAD",
    "allowed_stages": [
      "CMAD1",
      "CMAD2",
      "CMAD3"
    ],
    "effect_class": "READ",
    "implementation_route": "Repository-owned derivative retaining/extending reference behavior: Official document/API adapter",
    "reference_surfaces": [
      "https://developers.google.com/knowledge/mcp"
    ],
    "source_pin": null,
    "input_schema_pin": null,
    "output_schema_pin": null,
    "credential_scope_and_data_egress": {
      "proposed_principal": "hmt-cmad-discovery-retrieve",
      "resolved_identity_ref": null,
      "credential_handle_ref": null,
      "permitted_actions": [
        "discovery.retrieve"
      ],
      "resource_allowlist": [],
      "data_classification": "Private by default; clear exact exported fields before outbound use",
      "permitted_payload_fields": [],
      "destination_allowlist": [],
      "forbidden_data": [
        "credentials",
        "private method implementation",
        "unapproved mission data"
      ],
      "redaction_ref": null,
      "redirect_policy": "DENY_UNLESS_REVALIDATED",
      "revocation_owner": "Host/CSSI",
      "default": "DENY_EGRESS_UNTIL_BOUND"
    },
    "retry_reconciliation_owner": {
      "owner": "Continuity",
      "effect_identity": "Immutable host-minted intent/effect ID bound to canonical input, target resource, and contract; preserved across delivery/restart",
      "attempt_identity": "Distinct child attempt ID under original effect/deadline/budget",
      "reservation_identity": "New reservation only under the admitted protocol; previous reservation disposition preserved",
      "automatic_retry": true,
      "maximum_attempts": 3,
      "deadline_policy": "Original total deadline; no provider/SDK/worker reset",
      "terminal_conditions": [
        "HOLD",
        "DENIED",
        "revoked authority",
        "semantic/source drift",
        "OUTCOME_UNCERTAIN"
      ],
      "uncertain_completion": "Persist uncertainty, stop all repeat/alternate writes, route exact reservation to owner",
      "proof_requirement": "Authenticated exact-effect completion or durable cancellation/nonexecution proof; fresh grant before any new action",
      "alternate_provider_rule": "Only reviewed pure/read-only semantic equivalent after fresh guard; never bypass terminal condition"
    },
    "requirement_refs": [
      "HMT-F05",
      "HMT-F02",
      "HMT-F04",
      "HMT-F20",
      "HMT-B02",
      "HMT-B03",
      "HMT-B05"
    ],
    "resource_profile": "LOCAL-CTRL-1",
    "evidence_contract": [
      "input/output digests",
      "source/policy/schema/authority identities",
      "effect/attempt/reservation IDs where relevant",
      "observed effects and timing",
      "native disposition and replay reference"
    ],
    "readiness": "DESIGN_PINNED_EXECUTION_BLOCKED",
    "unresolved_bindings": [
      "Derivative commit/schema pins and read-only reference provenance",
      "Actual principal, credential handle, resource and destination allowlists",
      "Target harness and endpoint authority/reconciliation capability",
      "Measured profile qualification"
    ]
  },
  {
    "operation_id": "feasibility.catalog",
    "owner": "PMCT",
    "allowed_stages": [
      "PMCT1",
      "PMCT2"
    ],
    "effect_class": "READ",
    "implementation_route": "Repository-owned derivative retaining/extending reference behavior: Hub/API candidate catalog",
    "reference_surfaces": [
      "https://huggingface.co/docs/hub/agents-mcp"
    ],
    "source_pin": null,
    "input_schema_pin": null,
    "output_schema_pin": null,
    "credential_scope_and_data_egress": {
      "proposed_principal": "hmt-pmct-feasibility-catalog",
      "resolved_identity_ref": null,
      "credential_handle_ref": null,
      "permitted_actions": [
        "feasibility.catalog"
      ],
      "resource_allowlist": [],
      "data_classification": "Private by default; clear exact exported fields before outbound use",
      "permitted_payload_fields": [],
      "destination_allowlist": [],
      "forbidden_data": [
        "credentials",
        "private method implementation",
        "unapproved mission data"
      ],
      "redaction_ref": null,
      "redirect_policy": "DENY_UNLESS_REVALIDATED",
      "revocation_owner": "Host/CSSI",
      "default": "DENY_EGRESS_UNTIL_BOUND"
    },
    "retry_reconciliation_owner": {
      "owner": "Continuity",
      "effect_identity": "Immutable host-minted intent/effect ID bound to canonical input, target resource, and contract; preserved across delivery/restart",
      "attempt_identity": "Distinct child attempt ID under original effect/deadline/budget",
      "reservation_identity": "New reservation only under the admitted protocol; previous reservation disposition preserved",
      "automatic_retry": true,
      "maximum_attempts": 3,
      "deadline_policy": "Original total deadline; no provider/SDK/worker reset",
      "terminal_conditions": [
        "HOLD",
        "DENIED",
        "revoked authority",
        "semantic/source drift",
        "OUTCOME_UNCERTAIN"
      ],
      "uncertain_completion": "Persist uncertainty, stop all repeat/alternate writes, route exact reservation to owner",
      "proof_requirement": "Authenticated exact-effect completion or durable cancellation/nonexecution proof; fresh grant before any new action",
      "alternate_provider_rule": "Only reviewed pure/read-only semantic equivalent after fresh guard; never bypass terminal condition"
    },
    "requirement_refs": [
      "HMT-F06",
      "HMT-F02",
      "HMT-F04",
      "HMT-F20",
      "HMT-B02",
      "HMT-B03",
      "HMT-B05"
    ],
    "resource_profile": "LOCAL-CTRL-1",
    "evidence_contract": [
      "input/output digests",
      "source/policy/schema/authority identities",
      "effect/attempt/reservation IDs where relevant",
      "observed effects and timing",
      "native disposition and replay reference"
    ],
    "readiness": "DESIGN_PINNED_EXECUTION_BLOCKED",
    "unresolved_bindings": [
      "Derivative commit/schema pins and read-only reference provenance",
      "Actual principal, credential handle, resource and destination allowlists",
      "Target harness and endpoint authority/reconciliation capability",
      "Measured profile qualification"
    ]
  },
  {
    "operation_id": "trade.project",
    "owner": "PMCT",
    "allowed_stages": [
      "PMCT2",
      "PMCT3"
    ],
    "effect_class": "EVALUATION",
    "implementation_route": "Repository-owned derivative retaining/extending reference behavior: Existing hmt-trade-study project",
    "reference_surfaces": [
      "local:hmt-trade-study/1.0.0"
    ],
    "source_pin": null,
    "input_schema_pin": null,
    "output_schema_pin": null,
    "credential_scope_and_data_egress": {
      "proposed_principal": "hmt-pmct-trade-project",
      "resolved_identity_ref": null,
      "credential_handle_ref": null,
      "permitted_actions": [
        "trade.project"
      ],
      "resource_allowlist": [],
      "data_classification": "Private by default; clear exact exported fields before outbound use",
      "permitted_payload_fields": [],
      "destination_allowlist": [],
      "forbidden_data": [
        "credentials",
        "private method implementation",
        "unapproved mission data"
      ],
      "redaction_ref": null,
      "redirect_policy": "DENY_UNLESS_REVALIDATED",
      "revocation_owner": "Host/CSSI",
      "default": "DENY_EGRESS_UNTIL_BOUND"
    },
    "retry_reconciliation_owner": {
      "owner": "Custody",
      "effect_identity": "Immutable host-minted intent/effect ID bound to canonical input, target resource, and contract; preserved across delivery/restart",
      "attempt_identity": "Distinct child attempt ID under original effect/deadline/budget",
      "reservation_identity": "New reservation only under the admitted protocol; previous reservation disposition preserved",
      "automatic_retry": false,
      "maximum_attempts": 1,
      "deadline_policy": "Original total deadline; no provider/SDK/worker reset",
      "terminal_conditions": [
        "HOLD",
        "DENIED",
        "revoked authority",
        "semantic/source drift",
        "OUTCOME_UNCERTAIN"
      ],
      "uncertain_completion": "Persist uncertainty, stop all repeat/alternate writes, route exact reservation to owner",
      "proof_requirement": "Authenticated exact-effect completion or durable cancellation/nonexecution proof; fresh grant before any new action",
      "alternate_provider_rule": "Only reviewed pure/read-only semantic equivalent after fresh guard; never bypass terminal condition"
    },
    "requirement_refs": [
      "HMT-F06",
      "HMT-F02",
      "HMT-F04",
      "HMT-F20",
      "HMT-B02",
      "HMT-B03",
      "HMT-B05"
    ],
    "resource_profile": "LOCAL-CTRL-1",
    "evidence_contract": [
      "input/output digests",
      "source/policy/schema/authority identities",
      "effect/attempt/reservation IDs where relevant",
      "observed effects and timing",
      "native disposition and replay reference"
    ],
    "readiness": "DESIGN_PINNED_EXECUTION_BLOCKED",
    "unresolved_bindings": [
      "Derivative commit/schema pins and read-only reference provenance",
      "Actual principal, credential handle, resource and destination allowlists",
      "Target harness and endpoint authority/reconciliation capability",
      "Measured profile qualification"
    ]
  },
  {
    "operation_id": "trade.execute",
    "owner": "PMCT",
    "allowed_stages": [
      "PMCT2",
      "PMCT3"
    ],
    "effect_class": "LOCAL_MUTATION",
    "implementation_route": "Repository-owned derivative retaining/extending reference behavior: Existing study-owned execution/failover; no generic wrapper retry",
    "reference_surfaces": [
      "local:hmt-trade-study/1.0.0"
    ],
    "source_pin": null,
    "input_schema_pin": null,
    "output_schema_pin": null,